Candidate,Description,D_N,D_Resid,D_ROI,V_N,V_Resid,V_ROI,O_N,O_Resid,O_ROI,Verdict
C1,BP Availability Proxy (workload gap),347,0.0161,-1.04,168,-0.002,-4.59,160,-0.0244,-8.12,KILL (val fail)
C3,Post-Extras Depletion (one side only),174,0.0366,1.54,84,-0.1451,-36.35,162,0.0973,13.7,KILL (val fail)
C4,"SPID (SP-BP disagreement, bet SP)",278,0.0611,7.91,160,-0.0084,-5.95,147,-0.0129,-5.73,KILL (val fail)
C5,Low-Variance SP Advantage,160,0.041,3.71,89,-0.0139,-6.1,87,-0.0083,-5.46,KILL (val fail)
C6,Short-Leash SP x Weak BP,291,0.0176,-1.11,135,0.0667,8.96,162,-0.0143,-6.27,MONITOR
C7,Velocity Floor Breach (-0.5 mph trend),179,-0.0051,-5.6,151,0.007,-2.57,163,-0.0091,-5.95,KILL
C8,Command vs Stuff Archetype,130,0.045,4.97,83,0.018,1.26,55,0.0342,3.48,KEEP
C9,Low-Total Dog Compression (total<=7.5),919,0.0159,-1.0,664,-0.022,-8.99,394,0.0702,10.32,KILL (val fail)
C10,Home Dog + BP Edge,188,-0.0601,-16.39,88,0.0133,-1.13,80,0.0716,9.98,KILL
